{
  "report_title": "Python程序设计期末大作业报告",
  "project_name": "Python程序设计基础学习与实践",
  "code_block_mode": "none",
  "sections": [
    {
      "title": "Python语言概述与学习目标",
      "paragraphs": [
        "本学期我按照课程安排系统地学习了Python程序设计，从最基本的变量和数据类型开始，逐步接触到流程控制、函数、面向对象和文件操作等内容。在这里把学习过程中的理解和操作体会整理成报告，一方面回顾已经掌握的部分，另一方面也把还不熟练的地方写清楚。报告只讨论课程中实际练习过的语法和例子，不涉及自己没有做过的项目，也不编造任何运行数据和测试结果。"
      ],
      "subsections": [
        {
          "title": "语言特点与应用领域",
          "paragraphs": [
            "Python是一门解释型的编程语言，代码不需要先整体编译成可执行文件，写好之后由解释器逐行执行，所以在学习阶段修改、运行和验证都比较方便。它的语法相对简洁，用缩进代替大括号表示代码块，一行代码通常只完成一件事情，读起来比较接近自然语言。课程中我体会到，同样一个功能用Python写出来，格式上的负担要少一些，注意力可以更多放在解决问题的思路上。",
            "Python的应用范围比较广。课程中介绍过它常用于数据处理与分析、自动化脚本、网站后端开发以及人工智能相关方向，这些方向我目前只是了解，并没有真正做过。结合自己的使用体会，我觉得最直接的用途是写一些代替重复手工操作的小脚本，比如批量整理文件名、统计一段文本中的字数、对简单的表格数据做筛选。这类任务通常几十行代码就能完成，出错之后修改起来也不麻烦。",
            "Python还拥有大量第三方库，很多常见功能不需要从零开始实现，查找资料后直接调用即可。不过作为初学者，过早依赖现成的库容易忽略背后的基本原理，遇到问题时也不知道从哪里排查。所以本学期的学习重点仍然放在语言本身的语法和编程思路上，先把基础打牢，等到需要完成具体方向的任务时，再有针对性地学习相应领域的库。"
          ]
        },
        {
          "title": "学习目标与内容范围",
          "paragraphs": [
            "本学期的学习目标可以概括为三点。第一是掌握基础语法，能够读懂教材和课件中的示例程序，知道每一行语句在做什么；第二是具备独立编写小程序的能力，面对一个描述清楚的任务，可以自己拆解步骤并写出能运行的代码；第三是学会查阅资料，遇到不认识的函数或看不懂的报错信息时，能够通过官方文档和搜索找到比较可靠的解释，而不是凭猜测改动代码。",
            "报告的内容范围与课程讲授顺序基本一致，依次包括语言概述、基础语法与数据类型、流程控制与算法练习、函数与模块化设计、面向对象程序设计、文件操作与异常处理，最后是综合实践与学习总结。之所以按这个顺序展开，是因为后面的内容大多建立在前面的基础之上，比如函数中要用到条件判断和循环，类中要把函数和数据组织在一起，文件操作又依赖于对字符串和列表的处理。",
            "需要提前说明的是，我的编程基础并不扎实，学习过程中出现过不少低级错误，例如把赋值和判断写混、循环条件写错导致程序一直运行不停。报告中会如实记录这些问题以及最后的解决方式，对于课堂上听懂但自己动手仍然吃力的部分也会如实说明，不把只听过讲解的内容写成已经熟练掌握。"
          ]
        }
      ]
    },
    {
      "title": "基础语法与数据类型",
      "paragraphs": [
        "基础语法是后面所有内容的前提。这一部分整理变量、数据类型、运算符以及字符串和序列的基本用法，并记录初学阶段最容易踩到的一些问题，为后续的流程控制和函数学习做准备。"
      ],
      "subsections": [
        {
          "title": "变量、数据类型与运算符",
          "paragraphs": [
            "变量可以理解为一个名字，用来指向存放在内存中的某个值。Python属于动态类型语言，定义变量时不需要事先声明类型，只要写出名字并赋值即可，具体的类型由赋给它的值决定。同一个变量在程序运行过程中还可以重新指向另一种类型的值，这一点用起来灵活，但也要求写代码时清楚每个变量当前存放的是什么，否则很容易在运算时出现类型不匹配的错误。",
            "课程中接触到的常用数据类型有整数、浮点数、字符串和布尔值，此外还有列表、元组、字典和集合等复合类型。整数和浮点数之间可以相互转换，但转换会带来精度上的差别。例如两个整数相除得到的是浮点数结果，而用整除运算符得到的只是商的整数部分，余数要用取余运算符获取。判断一个数能否被另一个数整除时，正是使用取余运算的结果是否为零来判断，这类写法在后面的算法练习中出现得比较多。",
            "运算符方面，加、减、乘、除以及比较运算和逻辑运算的写法与数学中的习惯比较接近，但需要注意优先级。涉及多个运算符的表达式如果记不清优先级，加一对括号既不会影响结果，也能让代码更容易看懂。我最初经常出错的还有类型问题，比如把字符串和数字直接相加，程序运行时会直接报类型错误。后来养成了先确认变量类型再运算的习惯，并且学会用类型转换函数显式地转换，报错明显减少了。"
          ]
        },
        {
          "title": "字符串与序列操作",
          "paragraphs": [
            "字符串是最常用的数据类型之一，可以把它看作一串有序的字符。通过下标可以取出指定位置的字符，下标从零开始计数，使用负数下标则从末尾往前数。切片能够一次取出连续的一段内容，写出起始、结束和步长即可，不写结束位置就默认取到末尾。字符串本身不能被修改，想要改变内容只能生成一个新的字符串，这一点与列表不同，需要在使用时分清。",
            "列表和元组都是用来存放多个元素的有序序列，区别在于列表创建之后可以随时增加、删除或修改元素，而元组一旦建立就不能改变。列表的常用操作包括追加、插入、删除、排序和统计，遍历时一般使用for循环依次取出每个元素。元组适合存放那些在程序运行过程中不应该被改动的内容。我最初习惯把所有数据都放进列表，后来发现把固定不变的数据放到元组中，反而能避免无意中修改导致的问题。",
            "字典用来保存键与值之间的对应关系，适合根据一个已知条件去查找对应的信息，比如按学号查成绩、按名称查数量。字典中的键必须唯一，重复赋值会覆盖原来的值。使用下标取值时，如果键不存在程序会报错，所以更稳妥的方式是使用查找方法并给出默认值，或者先用成员判断确认键是否存在。列表、元组和字典之间的转换也比较常见，例如把字典的键或值取出转换成列表后再做排序和统计。"
          ]
        }
      ]
    },
    {
      "title": "程序流程控制与算法练习",
      "paragraphs": [
        "程序不会只按书写顺序从头执行到尾，更多时候需要根据条件选择不同的分支，或者重复执行某段代码。这一部分整理条件判断和循环的用法，并记录几个典型练习的思路与调试过程。"
      ],
      "subsections": [
        {
          "title": "条件判断与循环结构",
          "paragraphs": [
            "条件判断使用if语句，当条件成立时执行对应代码块，不成立时可以转到elif继续判断，全部不满足时执行else部分。书写时要注意冒号和缩进，缩进错位会让程序逻辑与设想完全不同。判断相等要用两个等号，一个等号表示赋值，这是初学者最常见的错误之一。多个条件同时成立才能通过的场合，用逻辑运算连接起来，比嵌套多层if更容易看懂。",
            "循环有两种常见写法：for循环适合遍历序列或执行确定次数的重复，while循环适合在条件成立期间一直重复，次数事先不确定的场合。循环体内可以用break提前结束整个循环，也可以用continue跳过本次剩余部分直接进入下一次。Python还允许在循环后面接else部分，当循环不是被break中断时执行，这一点和其他语言不同，需要在阅读代码时留意。",
            "循环练习中最容易出问题的是边界。例如求一到一百的累加和时，如果把结束条件写成小于而不是小于等于，结果就会少加一项；累加变量如果没有在循环之前初始化，程序也会报错。我做过猜数字、打印九九乘法表和统计字符出现次数等练习，反复出现的错误集中在循环次数、缩进层级和变量初值上。后来养成了先手写一遍执行过程、再对照程序运行结果的习惯，定位问题快了很多。"
          ]
        },
        {
          "title": "典型算法练习与调试",
          "paragraphs": [
            "排序和查找是最基础的算法练习。以冒泡排序为例，思路是反复比较相邻的两个元素，如果顺序不对就交换位置，每一轮结束后最大的元素会被移到末尾，经过若干轮之后整个序列就有序了。查找方面，顺序查找逐个比对，写法简单但对数据量大时效率不高；二分查找要求数据事先有序，每次取中间位置比较，可以快速缩小范围。理解这两种查找的差别之后，我才明白为什么有些步骤看起来多余却是必要的。",
            "遇到稍微复杂一点的任务时，直接开始写代码往往写不下去，比较有效的做法是先把问题拆成几个小步骤，每一步只完成一件明确的事情，分别验证通过之后再组合起来。例如统计一段文字中各字符出现的次数，可以拆成读取文字、逐个取出字符、在字典中累计次数、按次数排序输出四步。拆开之后每一步都很短，出错时也容易判断问题出在哪一步，不会因为整段代码都不能运行而无从下手。",
            "调试方面，我逐渐习惯了几种办法。第一种是在怀疑的语句前后打印中间变量的值，观察它是否和预期一致；第二种是仔细阅读报错信息，其中通常会指出出错的行号和错误类型，多数情况下看一眼就能找到原因；第三种是缩小范围，把可疑的代码单独拿出来运行。有一段时间我总想直接根据经验猜测问题，结果往往改错地方。把变量值打印出来对照之后，才发现实际执行过程和自己的想象差别很大。"
          ]
        }
      ]
    },
    {
      "title": "函数与模块化设计",
      "paragraphs": [
        "当程序变长之后，把所有语句都平铺在一处会越来越难维护。这一部分整理如何用函数封装重复逻辑，以及通过模块组织代码，让修改和复用变得容易一些。"
      ],
      "subsections": [
        {
          "title": "函数定义、参数与返回值",
          "paragraphs": [
            "函数用关键字定义，函数名后跟一对括号，括号中写参数，函数体通过缩进表示，需要返回结果时使用返回语句。调用函数就是把实际的数据传给形式参数，函数内部执行完毕后把结果交回调用位置。函数的好处在于把一段逻辑集中到一个地方，调用者只需要知道它做什么、需要什么数据，不必关心内部细节。同一个功能在多处出现时，把它写成函数可以避免每次修改都要改动很多地方。",
            "参数的使用方式比较灵活，可以为参数指定默认值，也可以在调用时以名称指定实参，这样即使参数顺序与定义不同也不会传错。函数还可以一次返回多个结果，调用方按顺序接收。默认参数的顺序有讲究，通常把带默认值的参数放在后面。我在练习中写过一个根据半径计算圆周长和面积的函数，返回两个结果后分别赋给不同变量，比在函数外部重复计算要清楚得多。",
            "作用域是另一个需要注意的知识点。在函数内部定义的变量一般只在该函数内有效，函数执行结束后就不能再访问；如果需要在函数内部修改函数外部的全局变量，必须使用global声明，否则只会生成一个新的局部变量。此外，把可变对象作为默认参数时，它的值会在多次调用之间被保留，从而导致结果与预期不符，正确的做法是把默认值设为空值，在函数体内再处理。把一段长长的流程拆成几个函数之后，我发现不仅代码变短了，排查问题时也能很快确定是哪一部分算错了。"
          ]
        },
        {
          "title": "模块、包与常用标准库",
          "paragraphs": [
            "模块就是保存了一组函数和变量的文件，使用导入语句之后就可以调用其中的内容。导入的写法有几种：可以导入整个模块，通过模块名加点的方式调用；也可以只导入需要的函数；还可以给模块起一个简短的别名，方便书写。导入之后解释器会按照一定顺序在若干位置查找模块文件，所以自己写的模块文件名尽量不要和标准库重名，否则会出现明明写对了却导入到另一个文件的情况。",
            "标准库中有不少模块在练习里很实用。数学模块提供了开方、取整和常量，随机模块可以生成随机数、从序列中随机选取元素，日期时间模块用来获取当前时间并进行格式化，系统模块可以处理路径、列出目录和判断文件是否存在。课程中的练习大多只用到其中很少一部分功能，但通过这些模块我体会到，先查看标准库能做什么，往往可以省去自己实现的时间。",
            "学习模块用法时，我发现直接查阅官方文档比在论坛里翻找零散答案更可靠，文档中通常会给出参数的顺序和返回值，还会附上简单示例，照着试一遍基本就能用起来。当自己写的函数逐渐变多之后，我尝试把同一类功能整理到一个文件里，在别的程序中导入使用，改一次就能让所有调用它的地方同步更新。这种复用的感受比较直接，也是这一章让我印象最深的部分。"
          ]
        }
      ]
    },
    {
      "title": "面向对象程序设计",
      "paragraphs": [
        "面向对象是课程中理解起来相对吃力的部分。这一部分整理类与对象的基本写法，以及封装、继承和多态的含义，并说明目前能够用到的程度和还不清楚的地方。"
      ],
      "subsections": [
        {
          "title": "类与对象的基本使用",
          "paragraphs": [
            "类可以理解为一种自定义的数据类型，它把若干数据和操作这些数据的方法组织在一起。定义类时先写关键字和类名，类体内部通常包含一个初始化方法，用来在创建对象时设置属性。创建对象的过程叫做实例化，对象创建完成后就可以通过点号访问它的属性，或者调用它的方法。相比用多个独立变量分别记录同一类事物的各项信息，把字段和行为放在一起更不容易弄混。",
            "类中定义的方法第一个参数通常代表对象自身，调用时不需要手工传入，这一点初学时容易忘记。属性可以定义在初始化方法中，每个对象各自保存一份；也可以定义在类体中，所有对象共享同一份。实际使用时要分清两者的区别，尤其在涉及可变对象时，把本应属于每个对象的属性写在类体中，会导致一个对象修改后其他对象也受到影响，而表面上看起来像是数据被莫名其妙地改写了。",
            "课程练习中以学生信息为例：先定义一个学生类，包含学号、姓名和若干门课程的成绩，再编写计算总分和平均分的方法。创建几个学生对象之后，分别调用方法得到结果，比用多个列表分别保存学号、姓名和成绩更清楚，也不容易因为下标对不上而取错数据。需要注意的是，练习中使用的都是虚构的编号和信息，不涉及任何真实人员的数据。"
          ]
        },
        {
          "title": "封装、继承与多态的理解",
          "paragraphs": [
            "封装指的是把数据和对数据的操作包装在一起，并通过一定方式限制外部直接访问内部细节。Python约定以两条下划线开头的属性或方法视为内部使用，外部不应当直接访问，而是通过专门的方法读写。这样做的意义在于，当内部实现需要调整时，只要对外提供的调用方式不变，使用它的代码就不必跟着改动，修改的范围被限制在一个类内部。",
            "继承用来描述一般与特殊的关系，子类可以继承父类的属性和方法，在此基础上增加新的内容，或者重写父类中不合适的部分。重写之后调用同名方法，会执行子类的版本。使用继承时要注意，子类的初始化方法如果需要在父类基础上扩展，应当显式调用父类的初始化方法，否则父类中定义的属性不会被创建，后续调用就会报错。继承层次不宜过深，否则阅读代码时需要不断向上查找方法的来源。",
            "多态指的是不同的对象对同一个方法调用做出各自的响应。比如几个不同类型的对象都提供了同名的处理方法，把它们放进同一个列表后循环调用，程序不需要判断具体是哪种类型，就能分别执行对应的实现。这样可以在增加新类型时少改动原有代码。这一部分我目前只理解到会用简单例子的程度，对于更复杂的继承结构和设计方式还没有把握，需要在后续练习中继续体会。"
          ]
        }
      ]
    },
    {
      "title": "文件操作、异常处理与综合实践",
      "paragraphs": [
        "前面几章的程序大多只处理内存中的数据，程序一旦结束，结果就随之消失。这一部分整理程序与文件之间的数据交换方式，以及如何处理运行过程中可能出现的异常，最后用一个规模可控的小例子把学过的内容串起来。"
      ],
      "subsections": [
        {
          "title": "文件读写与异常处理",
          "paragraphs": [
            "打开文件使用内置的open函数，需要指定文件路径和模式。读取模式用于读取已有内容，写入模式会新建文件或覆盖原有内容，追加模式则在文件末尾继续写入而不删除原内容。读取时可以一次读入全部内容，也可以逐行读取，后者在文件较大时更节省内存。更推荐使用with语句，代码块执行结束后文件会自动关闭，即使中途出现异常也能保证资源被释放。",
            "处理文件时有两个问题反复出现。一是路径问题，相对路径是相对于程序运行的位置，而不是文件所在的位置，路径写错时会提示找不到文件；二是编码问题，读写中文时如果使用的编码与文件实际编码不一致，就会出现乱码或者直接报错，比较稳妥的做法是读写时明确指定编码。此外还要注意写入内容必须是字符串，数字需要先转换，写入多行时换行符要自己补充。",
            "异常处理使用try/except语句，把可能出错的代码放在try部分，出现异常时由对应的处理分支接手，程序不会直接中断。可以针对不同类型的异常分别处理，也可以在处理之后执行清理工作，还可以让不属于当前处理范围的异常继续向上抛出。练习中比较典型的场景是文件不存在、用户输入的不是数字、把字符串当数字参与运算等。加入异常处理之后，程序从一遇到错误就退出，变成能给出提示并要求重新输入，使用起来更完整。"
          ]
        },
        {
          "title": "小型综合实例的实现过程",
          "paragraphs": [
            "综合练习我选择做一个控制台下的成绩统计程序，功能包括录入若干条学生记录、计算每人的总分与平均分、按平均分排序输出以及把结果保存到文本文件中。选择这个题目的原因是它规模不大，但能够同时用到列表和字典、循环与判断、函数拆分、简单的类以及文件读写，正好检验前面几章的学习情况。数据全部由自己虚构填写，不使用真实的学生信息和成绩。",
            "实现时先把功能拆成几部分：一部分负责接收输入并做格式检查，一部分负责计算统计结果，一部分负责排序和输出，还有一部分负责读写文件。各部分的逻辑分别写好后放入函数，再在主流程中按顺序调用。数据组织上，每条记录用一个字典保存各项信息，所有记录放进列表统一管理。按这个顺序推进的好处是每一步都能单独运行验证，不必等整个程序写完才知道对不对。",
            "过程中遇到的问题主要有三类：输入非数字内容导致程序报错，排序时对字典的取值方式不熟悉导致结果不符合预期，以及写入文件后再次运行程序时旧内容被覆盖。针对第一个问题加入了对输入内容的判断和提示，第二个问题通过查阅文档改用按指定字段排序的写法解决，第三个问题把写入模式改为追加模式，并约定文件末尾用固定符号分隔记录，读取时再按分隔符切分。这个程序的完成度有限，界面也比较简陋，但它确实是我自己一步步调通的，遇到的错误和解决过程也比单纯看例题印象更深。"
          ]
        }
      ]
    },
    {
      "title": "学习总结与不足",
      "paragraphs": [
        "通过一个学期的学习，我基本掌握了Python的基础语法，能够读懂课堂上给出的示例程序，也能独立写出完成简单任务的小程序。变量与数据类型、条件判断与循环、函数的定义与调用、类与对象的基本写法、文件的读写以及异常处理，这些内容在综合练习中都实际用到过。相比学期初看到报错就手足无措，现在至少能够根据报错信息判断问题大致出在哪一行、属于哪一类错误，也能借助文档和搜索找到解决办法。",
        "同时我也清楚地看到自己的不足。首先是算法能力薄弱，除了教材上的排序和查找，遇到新问题往往想不到合适的思路，写出来的代码虽然能得出结果，但步骤偏多、不够简洁。其次是异常处理不完整，目前只会处理几种常见情况，对异常类型的选择和清理逻辑的安排还不够熟练。此外，代码规范方面也存在问题，函数名命名随意，缺少必要注释，回过头阅读自己一个月前写的代码时常需要重新推敲。这些不足不是靠看讲解就能解决的，必须通过反复动手练习才能改善。",
        "针对这些问题，我计划在接下来的时间里做三件事：一是把课程中的例题和练习从头到尾独立重写一遍，不看答案，写完再对照，重点体会思路而不是背代码；二是每周完成一到两道基础算法题，从简单题目开始，先写出能运行的版本，再考虑如何简化；三是坚持给代码写注释和说明，逐步养成规范的书写习惯。Python的知识体系比较庞大，一个学期的学习只是起步，我会保持踏实的态度继续练习，不夸大已经掌握的程度。"
      ]
    }
  ]
}
