{
  "report_title": "校园失物招领管理系统的设计与实现",
  "project_name": "失物招领",
  "code_block_mode": "none",
  "sections": [
    {
      "title": "项目概述",
      "paragraphs": [
        "在日常学习和生活中，钥匙、校园卡、书本等物品丢失的情况比较常见。传统的寻找方式主要依靠群消息或线下询问，信息容易被新的消息覆盖，也不方便按照时间和地点进行筛选。为改善这一问题，本项目设计了一个校园失物招领管理系统，用来集中发布失物与拾物信息，并为使用者提供查询、认领和状态更新功能。"
      ],
      "subsections": [
        {
          "title": "1.1 设计目标",
          "paragraphs": [
            "系统的主要目标是让信息发布过程更加清楚。使用者可以填写物品名称、发现地点、时间和联系方式，也可以根据关键词查看已有记录。考虑到课程项目的规模，系统不追求复杂功能，而是优先保证发布、查询和认领三个基本流程能够正常完成，同时尽量保持界面简单。"
          ]
        }
      ]
    },
    {
      "title": "系统设计与实现",
      "paragraphs": [
        "项目采用分层思路组织代码，将界面显示、业务处理和数据保存分别放在不同模块中。这样安排后，修改界面时不需要同时改动全部数据操作，出现问题时也更容易判断故障位置。数据表主要记录物品编号、名称、类别、地点、发布时间和处理状态，字段数量保持在完成任务所需的范围内。"
      ],
      "subsections": [
        {
          "title": "2.1 功能模块",
          "paragraphs": [
            "发布模块负责接收输入内容，并检查物品名称和地点是否为空；查询模块支持按照类别和关键词筛选记录；认领模块在确认信息后修改物品状态，避免同一物品被重复处理。管理员功能只保留删除明显无效信息和查看全部记录两项，减少不必要的权限设置。"
          ],
          "image_placeholder": "图2-1 系统主要功能界面截图"
        },
        {
          "title": "2.2 实现过程",
          "paragraphs": [
            "实现过程中，我先完成数据表和基础增删改查，再连接界面按钮进行测试。开始时，查询结果刷新不及时，新增信息后必须重新打开页面才能看到。检查后发现列表没有在保存成功后重新读取数据，因此在提交操作完成后增加了刷新步骤。修改后，多次连续发布和查询都能显示最新记录。"
          ]
        }
      ]
    },
    {
      "title": "测试与总结",
      "paragraphs": [
        "本次测试主要围绕正常输入、空内容和重复认领三种情况进行。正常填写时可以保存并查询记录；缺少必要字段时会给出提示；已经完成认领的物品不能再次提交。测试范围还比较有限，没有覆盖大量用户同时访问的情况，因此目前只能说明基本流程能够运行，不能直接认为系统已经适合正式使用。"
      ],
      "subsections": [
        {
          "title": "3.1 项目总结",
          "paragraphs": [
            "通过这次项目，我对从需求整理、数据设计到功能测试的完整过程有了更具体的认识。系统仍可以继续增加图片上传、信息审核和消息提醒等功能，但这些内容需要更多时间验证。现阶段的结果基本达到了课程练习目标，也让我认识到清晰的模块划分和逐步测试比一次加入大量功能更可靠。"
          ]
        }
      ]
    }
  ]
}
