{
  "report_title": "校园网络服务体验与改进建议",
  "project_name": "校园网络服务改进",
  "code_block_mode": "none",
  "sections": [
    {
      "title": "问题背景与观察",
      "paragraphs": [
        "校园网络已经成为学习和日常沟通的重要工具。平时查阅资料、提交作业、参加线上课程和使用校内系统时，网络连接是否稳定会直接影响任务完成的效率。通过一段时间的使用，我发现多数场所能够满足基本需求，但在人员集中、设备同时接入较多的时段，连接速度和登录体验仍有改进空间。",
        "这些现象不一定完全由网络带宽造成，也可能与终端设置、无线覆盖位置和使用高峰有关。因此，讨论改进方法时不能只追求更快的速度，而应把稳定性、便利性和故障反馈效率放在一起考虑。"
      ],
      "subsections": [
        {
          "title": "（一）常见使用场景",
          "paragraphs": [
            "在教室、图书馆和宿舍等场景中，使用需求差别较大。上课期间更多是访问教学平台和下载课件，图书馆使用者常同时检索资料和观看学习视频，宿舍晚间则可能出现较多设备同时联网的情况。不同场景的高峰时间不一致，管理时应根据实际记录安排巡查和调整。"
          ]
        }
      ]
    },
    {
      "title": "主要影响因素分析",
      "paragraphs": [
        "网络体验首先受到接入人数的影响。当许多设备在同一时间连接同一个接入点时，即使每个人只进行普通浏览，也可能出现页面打开变慢、视频缓冲或短暂掉线。其次，部分使用者不了解认证流程，密码过期、设备重复认证等问题也会被误认为网络故障，增加了处理时间。处理人员若能区分设备端问题与网络端问题，就可以把有限的维护时间用在更需要处理的环节上。"
      ],
      "subsections": [
        {
          "title": "（一）信息提示不够直观",
          "paragraphs": [
            "出现问题后，使用者最需要的是明确的提示，例如当前是否处于维护时段、应该检查哪些设置、反馈渠道在哪里。如果提示过于分散，大家容易反复尝试连接，既浪费时间，也会使简单问题变得难以判断。将常见问题整理成简短说明，可以减少不必要的等待。"
          ]
        }
      ]
    },
    {
      "title": "改进建议与预期效果",
      "paragraphs": [
        "我认为可以从日常维护和服务沟通两方面逐步改进。对于使用高峰明显的区域，可先通过连接数量和故障记录判断是否需要优化设备位置或增加接入能力；对于认证、密码和终端设置等高频问题，可在登录页面提供简洁的操作指引，并保留清晰的反馈入口。这样做不需要一次性改变全部设施，但能让有限资源优先解决重复出现的问题。",
        "改进后还应保持定期检查。可以根据反馈数量、问题类型和处理时长进行简单汇总，观察措施是否真正减少了连接困难。若某些问题持续出现，就需要进一步了解原因，而不是只依靠临时处理。通过持续记录和小范围调整，网络服务会更贴近实际学习需求。"
      ],
      "image_placeholder": "可选：此处插入校园网络使用流程示意图"
    }
  ]
}
